{
    "$schema": "../schemas/penalties.schema.json",
    "version": "1.1",
    "bus": {
        "deficit_segments": [
            { "depth_mw": 500, "cost": 1000.0 },
            { "depth_mw": 1000, "cost": 3000.0 },
            { "depth_mw": null, "cost": 5000.0 }
        ],
        "excess_cost": 100.0
    },
    "line": {
        "exchange_cost": 2.0
    },
    "hydro": {
        "spillage_cost": 0.01,
        "diversion_cost": 0.1,
        "turbined_violation_below_cost": 500.0,
        "outflow_violation_below_cost": 500.0,
        "outflow_violation_above_cost": 500.0,
        "generation_violation_below_cost": 1000.0,
        "evaporation_violation_cost": 5000.0,
        "water_withdrawal_violation_cost": 1000.0
    }
}
